Key;English;French;German;Polish;Spanish;Italian;Swedish;Czech;Hungarian;Dutch;Portuguese;Russian;Finnish;
EVTDESC60010_NEWS_MEDIUM;Speaking from government offices in $CAPITAL$, the $COUNTRY_ADJ$ leadership announced the suspension of many freedoms and voting rights 'to combat the current crisis'. Many see this as an installation of $COUNTRY$'s reactionary president as dictator with the support of the $COUNTRY_ADJ$ military, and they would be correct.;;;;Hablando desde las oficinas gubernamentales en $CAPITAL$, el liderazgo de $COUNTRY_ADJ$ anunció la suspensión de muchas libertades y derechos de voto 'para combatir la crisis actual'. Muchos ven esto como una instalación del presidente reaccionario de $COUNTRY$ como dictador con el apoyo de las fuerzas armadas de $COUNTRY_ADJ$, y estarían en lo correcto.;;;;;;;;x
EVTDESC60010_NEWS_SHORT;The $COUNTRY_ADJ$ leadership announced the suspension of freedoms 'to combat the current crisis'. Many see this as an installation of $COUNTRY$'s reactionary president as sole ruler and dictator, and they would be correct.;;;;La dirigencia de $COUNTRY_ADJ$ anunció la suspensión de las libertades 'para combatir la crisis actual'. Muchos ven esto como una instalación del presidente reaccionario de $COUNTRY$ como único gobernante y dictador, y estarían en lo correcto.;;;;;;;;x
EVTNAME60020_NEWS_TITLE;Anarcho-Liberals Seize Power in $COUNTRY$!;;;;?Los anarco-liberales toman el poder en $COUNTRY$!;;;;;;;;x
EVTDESC60020_NEWS_LONG;In the interests of protecting the principles of liberty from the crushing onslaught of democracy, plebeian aristocracy and mob rule, a committee of concerned members of the ruling radical party have seized power in $COUNTRY$ and transformed the country into a minimal government dictatorship. It's only temporary, they say, a way to combat the current crisis, though many have doubts this is true, or that $COUNTRY$ will ever be restored to true democratic rule unless the radicals are someday overthrown.;;;;Con el fin de proteger los principios de la libertad del aplastante ataque de la democracia, la aristocracia plebeya y el gobierno de la mafia, un comité de miembros preocupados del partido radical gobernante tomó el poder en $COUNTRY$ y transformó el país en una dictadura de gobierno mínimo. Es solo temporal, dicen, una forma de combatir la crisis actual, aunque muchos tienen dudas de que esto sea cierto, o que $COUNTRY$ alguna vez sea restaurado a un verdadero gobierno democrático a menos que algún día los radicales sean derrocados.;;;;;;;;x
EVTDESC60020_NEWS_MEDIUM;In the interests of protecting the principles of liberty from the crushing onslaught of democracy, plebeian aristocracy and mob rule, a committee of concerned members of the ruling radical party have seized power in $COUNTRY$ and transformed the country into a minimal government dictatorship.;;;;Con el fin de proteger los principios de la libertad del aplastante ataque de la democracia, la aristocracia plebeya y el gobierno de la mafia, un comité de miembros preocupados del partido radical gobernante tomó el poder en $COUNTRY$ y transformó el país en una dictadura de gobierno mínimo.;;;;;;;;x
EVTDESC60020_NEWS_SHORT;A committee of concerned members of the ruling radical party have seized power in $COUNTRY$ and transformed the country into a government dictatorship. A temporary measure, they say, to combat the current crisis.;;;;Un comité de miembros preocupados del partido radical gobernante tomó el poder en $COUNTRY$ y transformó el país en una dictadura gubernamental. Una medida temporal, dicen, para combatir la crisis actual.;;;;;;;;x
EVTNAME60030_NEWS_TITLE;Fascists Seize Power in $COUNTRY$!;;;;?Los fascistas toman el poder en $COUNTRY$!;;;;;;;;x
EVTDESC60030_NEWS_LONG;Voting rights have been curtailed, the party system has gradually slipped under state control, and a bill on the expansion of the extraordinary powers of the state has successfully passed the house in $CAPITAL$. The signs are clear and plain: the fascist ruling party has transformed $COUNTRY$ from a democracy into a fascist dictatorship. Already the $COUNTRY_ADJ$ government has been reported clamping down on protests, black-shirted enforcers visible on every block in every major city. All this, according to the ruling party, will see $COUNTRY$ achieve the destiny it so richly deserves.;;;;Se han restringido los derechos de voto, el sistema de partidos se ha deslizado gradualmente bajo el control del estado, y un proyecto de ley sobre la expansión de los poderes extraordinarios del estado ha sido aprobado con éxito en $CAPITAL$. Las se?ales son claras y sencillas: el partido gobernante fascista ha transformado $COUNTRY$ de una democracia a una dictadura fascista. Ya se ha informado que el gobierno de $COUNTRY_ADJ$ ha tomado medidas drásticas contra las protestas, con ejecutores vestidos con camisas negras visibles en cada cuadra de cada ciudad importante. Todo esto, según el oficialismo, hará que $COUNTRY$ alcance el destino que tanto se merece.;;;;;;;;x
EVTDESC60030_NEWS_MEDIUM;Voting rights have been curtailed, the party system has gradually slipped under state control, and a bill on the expansion of the extraordinary powers of the state has successfully passed the house in $CAPITAL$. The signs are clear and plain: the ruling party has transformed $COUNTRY$ into a fascist dictatorship.;;;;Se han restringido los derechos de voto, el sistema de partidos se ha deslizado gradualmente bajo el control del estado, y un proyecto de ley sobre la expansión de los poderes extraordinarios del estado ha sido aprobado con éxito en $CAPITAL$. Las se?ales son claras y sencillas: el partido gobernante ha transformado $COUNTRY$ en una dictadura fascista.;;;;;;;;x
EVTDESC60030_NEWS_SHORT;The signs are clear: with the recent expansion of the fascist party's executive powers, $COUNTRY$ has been transformed from a democracy into a fascist dictatorship.;;;;Las se?ales son claras: con la reciente expansión de los poderes ejecutivos del partido fascista, $COUNTRY$ se ha transformado de una democracia a una dictadura fascista.;;;;;;;;x
EVTDESC60050_NEWS_LONG;The $COUNTRY_ADJ$ dictatorship is not what it used to be. Increased pluralism, combined with extended political reforms, has led to the dictatorship more and more taking on the trappings of a democracy. While this doesn't necessarily mean that the ruling party has given up its reign on power, with the recent calling of elections this does mean that the opposition now has some chance of making its voice heard. $COUNTRY$ has become a democracy, and crowds have gathered in $CAPITAL$ to celebrate the idea that their rulers might soon be peacefully removed from power.;;;;La dictadura de $COUNTRY_ADJ$ ya no es lo que era. El aumento del pluralismo, combinado con amplias reformas políticas, ha llevado a la dictadura a adoptar cada vez más las trampas de una democracia. Si bien esto no significa necesariamente que el partido gobernante haya renunciado a su reinado en el poder, con la reciente convocatoria de elecciones significa que la oposición ahora tiene alguna posibilidad de hacer oír su voz. $COUNTRY$ se ha convertido en una democracia, y las multitudes se han reunido en $CAPITAL$ para celebrar la idea de que sus gobernantes pronto podrían ser destituidos pacíficamente del poder.;;;;;;;;x
EVTDESC60050_NEWS_MEDIUM;The $COUNTRY_ADJ$ dictatorship is not what it used to be. While the ruling party has not yet given up power, increased pluralism, combined with extended political reforms and the recent call for new elections, has led to the dictatorship more and more taking on the trappings of a democracy.;;;;La dictadura de $COUNTRY_ADJ$ ya no es lo que era. Si bien el partido gobernante aún no ha renunciado al poder, el aumento del pluralismo, combinado con reformas políticas extendidas y la reciente convocatoria de nuevas elecciones, ha llevado a la dictadura a adoptar cada vez más las trampas de una democracia.;;;;;;;;x
EVTDESC60050_NEWS_SHORT;While the $COUNTRY_ADJ$ ruling party has not yet given up power, the recent reforms and call for new elections  has led to the dictatorship more and more taking on the trappings of a democracy.;;;;Si bien el partido gobernante $COUNTRY_ADJ$ aún no ha renunciado al poder, las reformas recientes y el llamado a nuevas elecciones han llevado a la dictadura a asumir cada vez más las trampas de una democracia.;;;;;;;;x
EVTNAME60060_NEWS_TITLE;The $COUNTRY_ADJ$ Constitution;;;;La Constitución de $COUNTRY_ADJ$;;;;;;;;x
EVTDESC60060_NEWS_LONG;The political reforms enacted in the past few years have led to a situation where the absolutism of the $COUNTRY_ADJ$ monarchy can now legitimately be called into question. No longer is the $COUNTRY_ADJ$ king free to dictate the course of the nation to his own musings, but instead has had to accept several constitutional hems and restrictions on his exercise of power. Some question the right of the monarch to override decisions by the newly-elected government, or even refuse to accept the results of an election entirely, but the fact that elections are being permitted at all is considered a sure sign of $COUNTRY$'s democratization.;;;;Las reformas políticas promulgadas en los últimos a?os han llevado a una situación en la que el absolutismo de la monarquía $COUNTRY_ADJ$ ahora puede ser legítimamente cuestionado. El rey de $COUNTRY_ADJ$ ya no es libre de dictar el curso de la nación según sus propios pensamientos, sino que ha tenido que aceptar varios dobladillos constitucionales y restricciones en su ejercicio del poder. Algunos cuestionan el derecho del monarca a anular las decisiones del gobierno recién elegido, o incluso se niegan a aceptar los resultados de una elección por completo, pero el hecho de que se permitan las elecciones se considera una se?al segura de la voluntad de $COUNTRY$. democratización.;;;;;;;;x
EVTDESC60060_NEWS_MEDIUM;The reforms enacted in the past few years have led to a situation where the $COUNTRY_ADJ$ monarchy no longer exerts absolute authority. No longer is the king free to dictate the course of the nation to his own musings, but instead has had to accept several constitutional hems and restrictions on his exercise of power.;;;;Las reformas promulgadas en los últimos a?os han llevado a una situación en la que la monarquía $COUNTRY_ADJ$ ya no ejerce autoridad absoluta. El rey ya no es libre de dictar el curso de la nación según sus propias reflexiones, sino que ha tenido que aceptar varios dobladillos y restricciones constitucionales en su ejercicio del poder.;;;;;;;;x
EVTDESC60060_NEWS_SHORT;Political reforms have led to a situation where the $COUNTRY_ADJ$ monarchy no longer exerts absolute authority. The king has accepted several constitutional restrictions on his exercise of power.;;;;Las reformas políticas han llevado a una situación en la que la monarquía de $COUNTRY_ADJ$ ya no ejerce autoridad absoluta. El rey ha aceptado varias restricciones constitucionales a su ejercicio del poder.;;;;;;;;x
EVTNAME60070_NEWS_TITLE;Democracy in $COUNTRY$;;;;Democracia en $COUNTRY$;;;;;;;;x
EVTDESC60070_NEWS_LONG;The sweeping reforms to the $COUNTRY_ADJ$ party system which have been enacted during the past few years have transformed $COUNTRY$ from an absolute monarchy into a democratically-ruled constitutional monarchy with a government responsible to the people. The $COUNTRY_ADJ$ monarch, now serving as a symbolic head-of-state, no longer has the power to personally control and determine the fate of the nation, but is instead forced to accept the mitigating influences of pluralism and limited democracy.;;;;Las amplias reformas al sistema de partidos de $COUNTRY_ADJ$ que se han promulgado durante los últimos a?os han transformado a $COUNTRY$ de una monarquía absoluta a una monarquía constitucional gobernada democráticamente con un gobierno responsable ante el pueblo. El monarca de $COUNTRY_ADJ$, que ahora actúa como jefe de estado simbólico, ya no tiene el poder de controlar y determinar personalmente el destino de la nación, sino que se ve obligado a aceptar las influencias mitigadoras del pluralismo y la democracia limitada.;;;;;;;;x
EVTDESC60070_NEWS_MEDIUM;The sweeping reforms to the $COUNTRY_ADJ$ party system which have been enacted during the past few years have transformed $COUNTRY$ from an absolute monarchy into a democratically-ruled constitutional monarchy with a government responsible to the people.;;;;Las amplias reformas al sistema de partidos de $COUNTRY_ADJ$ que se han promulgado durante los últimos a?os han transformado a $COUNTRY$ de una monarquía absoluta a una monarquía constitucional gobernada democráticamente con un gobierno responsable ante el pueblo.;;;;;;;;x
EVTDESC60070_NEWS_SHORT;The sweeping reforms to the $COUNTRY_ADJ$ party system which have been enacted during the past few years have transformed $COUNTRY$ from an absolute monarchy into a fully-democratic government responsible to the people.;;;;Las amplias reformas al sistema de partidos de $COUNTRY_ADJ$ que se han promulgado durante los últimos a?os han transformado a $COUNTRY$ de una monarquía absoluta a un gobierno totalmente democrático responsable ante el pueblo.;;;;;;;;x
EVTNAME60080_NEWS_TITLE;$COUNTRY_ADJ$ Voting Rights Rescinded;;;;$COUNTRY_ADJ$ Derechos de voto rescindidos;;;;;;;;x
EVTDESC60080_NEWS_LONG;Lately an eerie feeling has crept over citizens of $COUNTRY$ that their nation is growing oddly silent. Where before the free exchange of opinion and ideas could be heard, from street corners and bus stops to bars and universities, now only the sounds of silence gives echo. The conclusion that is becoming ever more evident, is that the tradition of $COUNTRY_ADJ$ democracy has been subverted. The ruling party has taken full control of $COUNTRY$ and transformed the nation into a dictatorship in all but name.;;;;Últimamente, los ciudadanos de $COUNTRY$ se han apoderado de una extra?a sensación de que su nación se está volviendo extra?amente silenciosa. Donde antes se escuchaba el libre intercambio de opiniones e ideas, desde las esquinas de las calles y las paradas de autobús hasta los bares y universidades, ahora solo los sonidos del silencio dan eco. La conclusión, cada vez más evidente, es que se ha subvertido la tradición de la democracia en $COUNTRY_ADJ$. El partido gobernante tomó el control total de $COUNTRY$ y transformó la nación en una dictadura en todo menos en el nombre.;;;;;;;;x
EVTDESC60080_NEWS_MEDIUM;Lately an eerie feeling has crept over citizens of $COUNTRY$ that their nation is growing oddly silent. The tradition of $COUNTRY_ADJ$ democracy has been subverted. The ruling party has taken full control of $COUNTRY$ and transformed the nation into a dictatorship in all but name.;;;;Últimamente, los ciudadanos de $COUNTRY$ se han apoderado de una extra?a sensación de que su nación se está volviendo extra?amente silenciosa. La tradición de la democracia de $COUNTRY_ADJ$ ha sido subvertida. El partido gobernante tomó el control total de $COUNTRY$ y transformó la nación en una dictadura en todo menos en el nombre.;;;;;;;;x
EVTDESC60080_NEWS_SHORT;According to recent reports, the tradition of $COUNTRY_ADJ$ democracy has been subverted. The ruling party has taken full control of $COUNTRY$ and transformed the nation into a dictatorship in all but name.;;;;Según informes recientes, la tradición de la democracia de $COUNTRY_ADJ$ ha sido subvertida. El partido gobernante tomó el control total de $COUNTRY$ y transformó la nación en una dictadura en todo menos en el nombre.;;;;;;;;x
EVTNAME11100_NEW;The Unification of $CULTURE_GROUP_UNION$;;;;La Unificación de $CULTURE_GROUP_UNION$;;;;;;;;x
EVTDESC11100_NEW;A rising tide of liberal nationalism within $CULTURE_GROUP_UNION$ has begun to spread, raising the idea of a $UNION_ADJ$ union with $COUNTRY$ at its head. A parliament of liberal revolutionaries has been convened, with representatives from throughout $UNION_ADJ$ lands, which has decreed the time is right for the nation to unite under one banner. The parliament has offered the crown of $CULTURE_GROUP_UNION$ to us. We could accept the offer, but doing so would cause international alarm, and require us to compensate the revolutionaries politically.;;;;Una ola creciente de nacionalismo liberal dentro de $CULTURE_GROUP_UNION$ ha comenzado a extenderse, planteando la idea de un sindicato $UNION_ADJ$ con $COUNTRY$ a la cabeza. Se ha convocado un parlamento de revolucionarios liberales, con representantes de todas las tierras de $UNION_ADJ$, que ha decretado que es el momento adecuado para que la nación se una bajo una sola bandera. El parlamento nos ha ofrecido la corona de $CULTURE_GROUP_UNION$. Podríamos aceptar la oferta, pero hacerlo causaría alarma internacional y requeriría que compensemos políticamente a los revolucionarios.;;;;;;;;x