key;key;;;;;;;x
EVTNAME181502;Spain asks for the ownership of Catalonia;;;;;;;x
EVTDESC181502;Napoleon annexed Catalonia when he began his invasion of Spain. But now that Spain is an ally and a power to be reckoned with, they ask that we give them Catalonia back, as a proof of friendship between our two nations.;;;;;;;x
EVTNAME600001;Russian Reconstruction;;;;;;;x
EVTDESC600001;After the difficult time that followed the invasion of our glorious nation by the french, we are finally recovering !;;;;;;;x
EVTNAME600002;Russian Reconstruction;;;;;;;x
EVTDESC600002;After the difficult time that followed the invasion of our glorious nation by the french, we are finally recovering !;;;;;;;x